kode_produk,nama,harga,deskripsi
S0000123,parallelism Perlengkapan Ibadah Goldenrod ,LION PARCEL,"parallelism Perlengkapan Ibadah Goldenrod  In hac habitasse platea dictumst. Morbi vestibulum, velit id pretium iaculis, diam erat fermentum justo, nec condimentum neque sapien placerat ante. Nulla justo."
S0000124,Networked Atasan Teal ,J&T EXPRESS,"Networked Atasan Teal  Mauris enim leo, rhoncus sed, vestibulum sit amet, cursus id, turpis. Integer aliquet, massa id lobortis convallis, tortor risus dapibus augue, vel accumsan tellus nisi eu orci. Mauris lacinia sapien quis libero."
S0000125,regional Aksesoris Red ,J&T EXPRESS,"regional Aksesoris Red  Aenean fermentum. Donec ut mauris eget massa tempor convallis. Nulla neque libero, convallis eget, eleifend luctus, ultricies eu, nibh."
S0000126,encoding Musik Teal ,PAHALA,"encoding Musik Teal  Aenean fermentum. Donec ut mauris eget massa tempor convallis. Nulla neque libero, convallis eget, eleifend luctus, ultricies eu, nibh."
S0000127,Robust Aksesoris Khaki ,JNE YES,Robust Aksesoris Khaki  Praesent id massa id nisl venenatis lacinia. Aenean sit amet justo. Morbi ut odio.
S0000128,impactful Baju Muslim Anak Aquamarine ,JNE OKE,"impactful Baju Muslim Anak Aquamarine  Duis bibendum, felis sed interdum venenatis, turpis enim blandit mi, in porttitor pede justo eu massa. Donec dapibus. Duis at velit eu est congue elementum."
S0000129,attitude Kesehatan Gigi & Mulut Green ,JNE OKE,"attitude Kesehatan Gigi & Mulut Green  Maecenas leo odio, condimentum id, luctus nec, molestie sed, justo. Pellentesque viverra pede ac diam. Cras pellentesque volutpat dui."
S0000130,Sharable Jam Tangan Khaki ,POS PAKET BIASA,"Sharable Jam Tangan Khaki  Cras mi pede, malesuada in, imperdiet et, commodo vulputate, justo. In blandit ultrices enim. Lorem ipsum dolor sit amet, consectetuer adipiscing elit."
S0000131,Quality-focused Pakaian Dalam Pria Indigo ,JNE YES,"Quality-focused Pakaian Dalam Pria Indigo  Quisque porta volutpat erat. Quisque erat eros, viverra eget, congue eget, semper rutrum, nulla. Nunc purus."
S0000132,multi-state Baju Tidur Fuscia ,WAHANA,"multi-state Baju Tidur Fuscia  Praesent blandit. Nam nulla. Integer pede justo, lacinia eget, tincidunt eget, tempus vel, pede."
S0000133,grid-enabled Makanan Indigo ,JNE YES,grid-enabled Makanan Indigo  Nullam porttitor lacus at turpis. Donec posuere metus vitae ipsum. Aliquam non mauris.
S0000134,tangible Sepatu Anak Laki-laki Pink ,POS PAKET BIASA,"tangible Sepatu Anak Laki-laki Pink  Praesent blandit. Nam nulla. Integer pede justo, lacinia eget, tincidunt eget, tempus vel, pede."
S0000135,capacity Sepatu Anak Perempuan Pink ,TIKI REGULER,capacity Sepatu Anak Perempuan Pink  Nulla ut erat id mauris vulputate elementum. Nullam varius. Nulla facilisi.
S0000136,context-sensitive Atasan Mauv ,TIKI REGULER,context-sensitive Atasan Mauv  Fusce consequat. Nulla nisl. Nunc nisl.
S0000137,monitoring Perlengkapan Medis Orange ,PAHALA,"monitoring Perlengkapan Medis Orange  Aenean fermentum. Donec ut mauris eget massa tempor convallis. Nulla neque libero, convallis eget, eleifend luctus, ultricies eu, nibh."
S0000138,static Perhiasan Indigo ,J&T EXPRESS,"static Perhiasan Indigo  Curabitur gravida nisi at nibh. In hac habitasse platea dictumst. Aliquam augue quam, sollicitudin vitae, consectetuer eget, rutrum at, lorem."
S0000139,content-based Figure Turquoise ,PAHALA,content-based Figure Turquoise  Duis aliquam convallis nunc. Proin at turpis a pede posuere nonummy. Integer non velit.
S0000140,project Outerwear Orange ,PAHALA,"project Outerwear Orange  Sed sagittis. Nam congue, risus semper porta volutpat, quam pede lobortis ligula, sit amet eleifend pede libero quis orci. Nullam molestie nibh in lectus."
S0000141,Implemented Tas Red ,POS PAKET BIASA,Implemented Tas Red  Praesent id massa id nisl venenatis lacinia. Aenean sit amet justo. Morbi ut odio.
S0000142,Optimized Health Products Green ,JNE REGULER,Optimized Health Products Green  Nullam sit amet turpis elementum ligula vehicula consequat. Morbi a ipsum. Integer a nibh.
S0000143,eco-centric Peralatan Make Up Orange ,POS PAKET KILAT,"eco-centric Peralatan Make Up Orange  Sed sagittis. Nam congue, risus semper porta volutpat, quam pede lobortis ligula, sit amet eleifend pede libero quis orci. Nullam molestie nibh in lectus."
S0000144,Persistent Kesehatan Lainnya Teal ,PAHALA,Persistent Kesehatan Lainnya Teal  Duis aliquam convallis nunc. Proin at turpis a pede posuere nonummy. Integer non velit.
S0000145,Networked Kesehatan Gigi & Mulut Teal ,PAHALA,"Networked Kesehatan Gigi & Mulut Teal  Praesent blandit. Nam nulla. Integer pede justo, lacinia eget, tincidunt eget, tempus vel, pede."
S0000146,model Musik Pink ,JNE OKE,"model Musik Pink  Morbi non lectus. Aliquam sit amet diam in magna bibendum imperdiet. Nullam orci pede, venenatis non, sodales sed, tincidunt eu, felis."
S0000147,human-resource Diet & Vitamin Crimson ,J&T EXPRESS,human-resource Diet & Vitamin Crimson  Integer ac leo. Pellentesque ultrices mattis odio. Donec vitae nisi.
S0000148,Extended Tas Anak Green ,WAHANA,Extended Tas Anak Green  Phasellus in felis. Donec semper sapien a libero. Nam dui.
S0000149,Right-sized Atasan Green ,J&T EXPRESS,"Right-sized Atasan Green  Nam ultrices, libero non mattis pulvinar, nulla pede ullamcorper augue, a suscipit nulla elit ac nulla. Sed vel enim sit amet nunc viverra dapibus. Nulla suscipit ligula in lacus."
S0000150,3rd generation Jam Tangan Goldenrod ,JNE REGULER,3rd generation Jam Tangan Goldenrod  Aliquam quis turpis eget elit sodales scelerisque. Mauris sit amet eros. Suspendisse accumsan tortor quis turpis.
S0000151,Extended Perhiasan Pink ,JNE YES,Extended Perhiasan Pink  Fusce consequat. Nulla nisl. Nunc nisl.
S0000152,Team-oriented Laptop Khaki ,J&T EXPRESS,Team-oriented Laptop Khaki  Suspendisse potenti. In eleifend quam a odio. In hac habitasse platea dictumst.
S0000153,Centralized Basket Indigo ,POS PAKET KILAT,"Centralized Basket Indigo  Maecenas tristique, est et tempus semper, est quam pharetra magna, ac consequat metus sapien ut nunc. Vestibulum ante ipsum primis in faucibus orci luctus et ultrices posuere cubilia Curae; Mauris viverra diam vitae quam. Suspendisse potenti."
S0000154,Devolved Makanan Indigo ,LION PARCEL,"Devolved Makanan Indigo  In hac habitasse platea dictumst. Morbi vestibulum, velit id pretium iaculis, diam erat fermentum justo, nec condimentum neque sapien placerat ante. Nulla justo."
S0000155,Reactive Handphone Khaki ,JNE REGULER,"Reactive Handphone Khaki  Aenean fermentum. Donec ut mauris eget massa tempor convallis. Nulla neque libero, convallis eget, eleifend luctus, ultricies eu, nibh."
S0000156,mobile Baju Tidur Blue ,WAHANA,"mobile Baju Tidur Blue  Donec diam neque, vestibulum eget, vulputate ut, ultrices vel, augue. Vestibulum ante ipsum primis in faucibus orci luctus et ultrices posuere cubilia Curae; Donec pharetra, magna vestibulum aliquet ultrices, erat tortor sollicitudin mi, sit amet lobortis sapien sapien non mi. Integer ac neque."
S0000157,Synchronised Pakaian Dalam Pria Yellow ,LION PARCEL,"Synchronised Pakaian Dalam Pria Yellow  In sagittis dui vel nisl. Duis ac nibh. Fusce lacus purus, aliquet at, feugiat non, pretium quis, lectus."
S0000158,hub Aksesoris Red ,LION PARCEL,"hub Aksesoris Red  Cras mi pede, malesuada in, imperdiet et, commodo vulputate, justo. In blandit ultrices enim. Lorem ipsum dolor sit amet, consectetuer adipiscing elit."
S0000159,infrastructure Aksesoris Mobil Mauv ,WAHANA,"infrastructure Aksesoris Mobil Mauv  Curabitur at ipsum ac tellus semper interdum. Mauris ullamcorper purus sit amet nulla. Quisque arcu libero, rutrum ac, lobortis vel, dapibus at, diam."
S0000160,encoding Tas Anak Blue ,POS PAKET KILAT,"encoding Tas Anak Blue  Nam ultrices, libero non mattis pulvinar, nulla pede ullamcorper augue, a suscipit nulla elit ac nulla. Sed vel enim sit amet nunc viverra dapibus. Nulla suscipit ligula in lacus."
S0000161,installation Atasan Goldenrod ,JNE OKE,"installation Atasan Goldenrod  Curabitur at ipsum ac tellus semper interdum. Mauris ullamcorper purus sit amet nulla. Quisque arcu libero, rutrum ac, lobortis vel, dapibus at, diam."
S0000162,Streamlined Perhiasan Fashion Pink ,JNE YES,"Streamlined Perhiasan Fashion Pink  Morbi non lectus. Aliquam sit amet diam in magna bibendum imperdiet. Nullam orci pede, venenatis non, sodales sed, tincidunt eu, felis."
S0000163,Down-sized Dress Blue ,J&T EXPRESS,"Down-sized Dress Blue  Quisque porta volutpat erat. Quisque erat eros, viverra eget, congue eget, semper rutrum, nulla. Nunc purus."
S0000164,Open-source Outerwear Goldenrod ,TIKI REGULER,"Open-source Outerwear Goldenrod  Curabitur in libero ut massa volutpat convallis. Morbi odio odio, elementum eu, interdum eu, tincidunt in, leo. Maecenas pulvinar lobortis est."
S0000165,human-resource Komputer Yellow ,JNE REGULER,human-resource Komputer Yellow  Aliquam quis turpis eget elit sodales scelerisque. Mauris sit amet eros. Suspendisse accumsan tortor quis turpis.
S0000166,Pre-emptive Basket Blue ,TIKI REGULER,Pre-emptive Basket Blue  Aliquam quis turpis eget elit sodales scelerisque. Mauris sit amet eros. Suspendisse accumsan tortor quis turpis.
S0000167,capacity Atasan Violet ,TIKI REGULER,capacity Atasan Violet  In hac habitasse platea dictumst. Etiam faucibus cursus urna. Ut tellus.
S0000168,projection Outerwear Mauv ,TIKI REGULER,"projection Outerwear Mauv  Morbi non lectus. Aliquam sit amet diam in magna bibendum imperdiet. Nullam orci pede, venenatis non, sodales sed, tincidunt eu, felis."
S0000169,Operative Boneka Aquamarine ,POS PAKET BIASA,Operative Boneka Aquamarine  Sed ante. Vivamus tortor. Duis mattis egestas metus.
S0000170,architecture Telinga Orange ,J&T EXPRESS,architecture Telinga Orange  Phasellus in felis. Donec semper sapien a libero. Nam dui.
S0000171,Automated Kamera Violet ,WAHANA,Automated Kamera Violet  In congue. Etiam justo. Etiam pretium iaculis justo.
S0000172,asymmetric Boneka Turquoise ,J&T EXPRESS,asymmetric Boneka Turquoise  Maecenas ut massa quis augue luctus tincidunt. Nulla mollis molestie lorem. Quisque ut erat.
S0000173,extranet Figure Turquoise ,PAHALA,extranet Figure Turquoise  Fusce consequat. Nulla nisl. Nunc nisl.
S0000174,infrastructure Atasan Mauv ,LION PARCEL,"infrastructure Atasan Mauv  Curabitur in libero ut massa volutpat convallis. Morbi odio odio, elementum eu, interdum eu, tincidunt in, leo. Maecenas pulvinar lobortis est."
S0000175,tangible Kesehatan Gigi & Mulut Orange ,JNE REGULER,"tangible Kesehatan Gigi & Mulut Orange  Nam ultrices, libero non mattis pulvinar, nulla pede ullamcorper augue, a suscipit nulla elit ac nulla. Sed vel enim sit amet nunc viverra dapibus. Nulla suscipit ligula in lacus."
S0000176,Down-sized Dress Turquoise ,JNE YES,"Down-sized Dress Turquoise  Maecenas leo odio, condimentum id, luctus nec, molestie sed, justo. Pellentesque viverra pede ac diam. Cras pellentesque volutpat dui."
S0000177,Sharable Outerwear Mauv ,WAHANA,"Sharable Outerwear Mauv  Lorem ipsum dolor sit amet, consectetuer adipiscing elit. Proin risus. Praesent lectus."
S0000178,protocol Perawatan Mata Khaki ,JNE OKE,protocol Perawatan Mata Khaki  Phasellus in felis. Donec semper sapien a libero. Nam dui.
S0000179,process improvement Minuman Violet ,PAHALA,"process improvement Minuman Violet  Cras mi pede, malesuada in, imperdiet et, commodo vulputate, justo. In blandit ultrices enim. Lorem ipsum dolor sit amet, consectetuer adipiscing elit."
S0000180,dedicated Perawatan Wajah Mauv ,J&T EXPRESS,dedicated Perawatan Wajah Mauv  Aenean lectus. Pellentesque eget nunc. Donec quis orci eget orci vehicula condimentum.
S0000181,6th generation Dress Orange ,J&T EXPRESS,6th generation Dress Orange  Sed ante. Vivamus tortor. Duis mattis egestas metus.
S0000182,model Figure Aquamarine ,JNE YES,model Figure Aquamarine  Nulla ut erat id mauris vulputate elementum. Nullam varius. Nulla facilisi.
S0000183,Reactive Aksesoris Teal ,POS PAKET KILAT,"Reactive Aksesoris Teal  Lorem ipsum dolor sit amet, consectetuer adipiscing elit. Proin risus. Praesent lectus."
S0000184,Self-enabling Dress Red ,LION PARCEL,Self-enabling Dress Red  Duis bibendum. Morbi non quam nec dui luctus rutrum. Nulla tellus.
S0000185,Distributed Telinga Red ,TIKI REGULER,"Distributed Telinga Red  Morbi non lectus. Aliquam sit amet diam in magna bibendum imperdiet. Nullam orci pede, venenatis non, sodales sed, tincidunt eu, felis."
S0000186,upward-trending Kesehatan Lainnya Khaki ,JNE YES,upward-trending Kesehatan Lainnya Khaki  Duis consequat dui nec nisi volutpat eleifend. Donec ut dolor. Morbi vel lectus in quam fringilla rhoncus.
S0000187,Organic Tas Violet ,LION PARCEL,"Organic Tas Violet  Curabitur in libero ut massa volutpat convallis. Morbi odio odio, elementum eu, interdum eu, tincidunt in, leo. Maecenas pulvinar lobortis est."
S0000188,zero tolerance Kesehatan Gigi & Mulut Orange ,JNE YES,"zero tolerance Kesehatan Gigi & Mulut Orange  Morbi non lectus. Aliquam sit amet diam in magna bibendum imperdiet. Nullam orci pede, venenatis non, sodales sed, tincidunt eu, felis."
S0000189,intranet Kesehatan Mata Teal ,LION PARCEL,intranet Kesehatan Mata Teal  Duis consequat dui nec nisi volutpat eleifend. Donec ut dolor. Morbi vel lectus in quam fringilla rhoncus.
S0000190,Future-proofed Kesehatan Lainnya Yellow ,JNE YES,"Future-proofed Kesehatan Lainnya Yellow  In sagittis dui vel nisl. Duis ac nibh. Fusce lacus purus, aliquet at, feugiat non, pretium quis, lectus."
S0000191,real-time Dress Aquamarine ,JNE YES,"real-time Dress Aquamarine  Vestibulum ac est lacinia nisi venenatis tristique. Fusce congue, diam id ornare imperdiet, sapien urna pretium nisl, ut volutpat sapien arcu sed augue. Aliquam erat volutpat."
S0000192,asynchronous Perawatan Mata Khaki ,POS PAKET KILAT,"asynchronous Perawatan Mata Khaki  Quisque id justo sit amet sapien dignissim vestibulum. Vestibulum ante ipsum primis in faucibus orci luctus et ultrices posuere cubilia Curae; Nulla dapibus dolor vel est. Donec odio justo, sollicitudin ut, suscipit a, feugiat et, eros."
S0000193,algorithm Sepatu Anak Laki-laki Fuscia ,POS PAKET KILAT,algorithm Sepatu Anak Laki-laki Fuscia  Nullam porttitor lacus at turpis. Donec posuere metus vitae ipsum. Aliquam non mauris.
S0000194,clear-thinking Aksesoris Mobil Blue ,POS PAKET KILAT,clear-thinking Aksesoris Mobil Blue  Cras non velit nec nisi vulputate nonummy. Maecenas tincidunt lacus at velit. Vivamus vel nulla eget eros elementum pellentesque.
S0000195,Customer-focused Boneka Green ,LION PARCEL,"Customer-focused Boneka Green  Praesent blandit. Nam nulla. Integer pede justo, lacinia eget, tincidunt eget, tempus vel, pede."
S0000196,global Aksesoris Mobil Green ,PAHALA,"global Aksesoris Mobil Green  Curabitur in libero ut massa volutpat convallis. Morbi odio odio, elementum eu, interdum eu, tincidunt in, leo. Maecenas pulvinar lobortis est."
S0000197,demand-driven Setelan Muslim Yellow ,LION PARCEL,demand-driven Setelan Muslim Yellow  In congue. Etiam justo. Etiam pretium iaculis justo.
S0000198,Operative Peralatan Make Up Pink ,J&T EXPRESS,"Operative Peralatan Make Up Pink  Vestibulum quam sapien, varius ut, blandit non, interdum in, ante. Vestibulum ante ipsum primis in faucibus orci luctus et ultrices posuere cubilia Curae; Duis faucibus accumsan odio. Curabitur convallis."
S0000199,time-frame Kamera Fuscia ,JNE OKE,"time-frame Kamera Fuscia  Maecenas leo odio, condimentum id, luctus nec, molestie sed, justo. Pellentesque viverra pede ac diam. Cras pellentesque volutpat dui."
S0000200,portal Kosmetik Orange ,JNE YES,"portal Kosmetik Orange  Cum sociis natoque penatibus et magnis dis parturient montes, nascetur ridiculus mus. Vivamus vestibulum sagittis sapien. Cum sociis natoque penatibus et magnis dis parturient montes, nascetur ridiculus mus."
S0000201,secondary Komputer Pink ,J&T EXPRESS,"secondary Komputer Pink  Proin leo odio, porttitor id, consequat in, consequat ut, nulla. Sed accumsan felis. Ut at dolor quis odio consequat varius."
S0000202,Proactive Perlengkapan Ibadah Red ,JNE YES,"Proactive Perlengkapan Ibadah Red  Vestibulum ac est lacinia nisi venenatis tristique. Fusce congue, diam id ornare imperdiet, sapien urna pretium nisl, ut volutpat sapien arcu sed augue. Aliquam erat volutpat."
S0000203,circuit Outerwear Green ,JNE REGULER,circuit Outerwear Green  In congue. Etiam justo. Etiam pretium iaculis justo.
S0000204,Fundamental Grooming Turquoise ,TIKI REGULER,"Fundamental Grooming Turquoise  Morbi porttitor lorem id ligula. Suspendisse ornare consequat lectus. In est risus, auctor sed, tristique in, tempus sit amet, sem."
S0000205,discrete TV Khaki ,J&T EXPRESS,discrete TV Khaki  Aenean lectus. Pellentesque eget nunc. Donec quis orci eget orci vehicula condimentum.
S0000206,Streamlined Baju Tidur Pink ,JNE YES,"Streamlined Baju Tidur Pink  In hac habitasse platea dictumst. Morbi vestibulum, velit id pretium iaculis, diam erat fermentum justo, nec condimentum neque sapien placerat ante. Nulla justo."
S0000207,complexity Perhiasan Fashion Khaki besar,LION PARCEL,"complexity Perhiasan Fashion Khaki besar Cum sociis natoque penatibus et magnis dis parturient montes, nascetur ridiculus mus. Vivamus vestibulum sagittis sapien. Cum sociis natoque penatibus et magnis dis parturient montes, nascetur ridiculus mus."
S0000208,leading edge Pakaian Anak Laki-Laki Aquamarine ,JNE OKE,"leading edge Pakaian Anak Laki-Laki Aquamarine  Fusce posuere felis sed lacus. Morbi sem mauris, laoreet ut, rhoncus aliquet, pulvinar sed, nisl. Nunc rhoncus dui vel sem."
S0000209,local Aksesoris Green ,J&T EXPRESS,local Aksesoris Green  Duis consequat dui nec nisi volutpat eleifend. Donec ut dolor. Morbi vel lectus in quam fringilla rhoncus.
S0000210,hierarchy Kesehatan Wanita Indigo ,WAHANA,hierarchy Kesehatan Wanita Indigo  Duis consequat dui nec nisi volutpat eleifend. Donec ut dolor. Morbi vel lectus in quam fringilla rhoncus.
S0000211,time-frame Pakaian Anak Laki-Laki Red ,POS PAKET BIASA,"time-frame Pakaian Anak Laki-Laki Red  Mauris enim leo, rhoncus sed, vestibulum sit amet, cursus id, turpis. Integer aliquet, massa id lobortis convallis, tortor risus dapibus augue, vel accumsan tellus nisi eu orci. Mauris lacinia sapien quis libero."
S0000212,cohesive Sepatu Anak Laki-laki Red ,JNE OKE,"cohesive Sepatu Anak Laki-laki Red  In hac habitasse platea dictumst. Morbi vestibulum, velit id pretium iaculis, diam erat fermentum justo, nec condimentum neque sapien placerat ante. Nulla justo."
S0000213,4th generation Outerwear Yellow ,TIKI REGULER,"4th generation Outerwear Yellow  Duis bibendum, felis sed interdum venenatis, turpis enim blandit mi, in porttitor pede justo eu massa. Donec dapibus. Duis at velit eu est congue elementum."
S0000214,application Outerwear Teal ,POS PAKET BIASA,"application Outerwear Teal  Duis bibendum, felis sed interdum venenatis, turpis enim blandit mi, in porttitor pede justo eu massa. Donec dapibus. Duis at velit eu est congue elementum."
S0000215,Open-source Makanan Maroon ,TIKI REGULER,Open-source Makanan Maroon  Integer tincidunt ante vel ipsum. Praesent blandit lacinia erat. Vestibulum sed magna at nunc commodo placerat.
S0000216,local area network Perawatan Wajah Violet ,PAHALA,"local area network Perawatan Wajah Violet  Maecenas tristique, est et tempus semper, est quam pharetra magna, ac consequat metus sapien ut nunc. Vestibulum ante ipsum primis in faucibus orci luctus et ultrices posuere cubilia Curae; Mauris viverra diam vitae quam. Suspendisse potenti."
S0000217,Switchable Health Products Crimson ,JNE REGULER,"Switchable Health Products Crimson  Curabitur gravida nisi at nibh. In hac habitasse platea dictumst. Aliquam augue quam, sollicitudin vitae, consectetuer eget, rutrum at, lorem."
S0000218,Networked Perlengkapan Medis Green ,JNE OKE,Networked Perlengkapan Medis Green  Integer ac leo. Pellentesque ultrices mattis odio. Donec vitae nisi.
S0000219,analyzer Aksesoris Anak Aquamarine ,JNE REGULER,analyzer Aksesoris Anak Aquamarine  Suspendisse potenti. In eleifend quam a odio. In hac habitasse platea dictumst.
S0000220,Team-oriented Aksesoris Mobil Blue ,POS PAKET KILAT,Team-oriented Aksesoris Mobil Blue  Sed ante. Vivamus tortor. Duis mattis egestas metus.
S0000221,orchestration TV Goldenrod ,POS PAKET KILAT,"orchestration TV Goldenrod  Curabitur at ipsum ac tellus semper interdum. Mauris ullamcorper purus sit amet nulla. Quisque arcu libero, rutrum ac, lobortis vel, dapibus at, diam."
S0000222,budgetary management Aksesoris Anak Red ,JNE REGULER,budgetary management Aksesoris Anak Red  Phasellus sit amet erat. Nulla tempus. Vivamus in felis eu sapien cursus vestibulum.
S0000223,portal Perhiasan Anak Goldenrod ,WAHANA,portal Perhiasan Anak Goldenrod  Maecenas ut massa quis augue luctus tincidunt. Nulla mollis molestie lorem. Quisque ut erat.
S0000224,intranet Komputer Fuscia ,WAHANA,"intranet Komputer Fuscia  In sagittis dui vel nisl. Duis ac nibh. Fusce lacus purus, aliquet at, feugiat non, pretium quis, lectus."
S0000225,paradigm Kamera Violet ,WAHANA,paradigm Kamera Violet  In hac habitasse platea dictumst. Etiam faucibus cursus urna. Ut tellus.
S0000226,Polarised TV Aquamarine ,TIKI REGULER,"Polarised TV Aquamarine  In hac habitasse platea dictumst. Morbi vestibulum, velit id pretium iaculis, diam erat fermentum justo, nec condimentum neque sapien placerat ante. Nulla justo."
S0000227,Function-based Aksesoris Crimson ,JNE REGULER,"Function-based Aksesoris Crimson  Proin eu mi. Nulla ac enim. In tempor, turpis nec euismod scelerisque, quam turpis adipiscing lorem, vitae mattis nibh ligula nec sem."
S0000228,Organized Aksesoris Bayi Blue ,WAHANA,"Organized Aksesoris Bayi Blue  Maecenas leo odio, condimentum id, luctus nec, molestie sed, justo. Pellentesque viverra pede ac diam. Cras pellentesque volutpat dui."
S0000229,Monitored Perlengkapan Ibadah Mauv ,WAHANA,Monitored Perlengkapan Ibadah Mauv  Etiam vel augue. Vestibulum rutrum rutrum neque. Aenean auctor gravida sem.
S0000230,benchmark Laptop Blue ,TIKI REGULER,benchmark Laptop Blue  Suspendisse potenti. In eleifend quam a odio. In hac habitasse platea dictumst.
S0000231,Profound Perlengkapan Couple Puce ,LION PARCEL,Profound Perlengkapan Couple Puce  Duis aliquam convallis nunc. Proin at turpis a pede posuere nonummy. Integer non velit.
S0000232,3rd generation Aksesoris Anak Crimson ,TIKI REGULER,"3rd generation Aksesoris Anak Crimson  Curabitur at ipsum ac tellus semper interdum. Mauris ullamcorper purus sit amet nulla. Quisque arcu libero, rutrum ac, lobortis vel, dapibus at, diam."
S0000233,Reverse-engineered Outerwear Mauv ,JNE REGULER,Reverse-engineered Outerwear Mauv  Sed ante. Vivamus tortor. Duis mattis egestas metus.
S0000234,Horizontal Atasan Indigo ,WAHANA,"Horizontal Atasan Indigo  Praesent blandit. Nam nulla. Integer pede justo, lacinia eget, tincidunt eget, tempus vel, pede."
S0000235,Intuitive Aksesoris Rambut Anak Green ,JNE YES,"Intuitive Aksesoris Rambut Anak Green  Quisque id justo sit amet sapien dignissim vestibulum. Vestibulum ante ipsum primis in faucibus orci luctus et ultrices posuere cubilia Curae; Nulla dapibus dolor vel est. Donec odio justo, sollicitudin ut, suscipit a, feugiat et, eros."
S0000236,directional Novel Sastra Goldenrod ,WAHANA,directional Novel Sastra Goldenrod  In hac habitasse platea dictumst. Etiam faucibus cursus urna. Ut tellus.
S0000237,even-keeled Sepatu Yellow ,JNE REGULER,"even-keeled Sepatu Yellow  Quisque id justo sit amet sapien dignissim vestibulum. Vestibulum ante ipsum primis in faucibus orci luctus et ultrices posuere cubilia Curae; Nulla dapibus dolor vel est. Donec odio justo, sollicitudin ut, suscipit a, feugiat et, eros."
S0000238,Re-engineered Basket Blue ,JNE REGULER,Re-engineered Basket Blue  Cras non velit nec nisi vulputate nonummy. Maecenas tincidunt lacus at velit. Vivamus vel nulla eget eros elementum pellentesque.
S0000239,throughput Perhiasan Anak Fuscia ,POS PAKET BIASA,"throughput Perhiasan Anak Fuscia  Cras mi pede, malesuada in, imperdiet et, commodo vulputate, justo. In blandit ultrices enim. Lorem ipsum dolor sit amet, consectetuer adipiscing elit."
S0000240,knowledge base Pakaian Anak Perempuan Puce ,POS PAKET BIASA,knowledge base Pakaian Anak Perempuan Puce  Pellentesque at nulla. Suspendisse potenti. Cras in purus eu magna vulputate luctus.
S0000241,Proactive Diet & Vitamin Goldenrod besar,POS PAKET KILAT,Proactive Diet & Vitamin Goldenrod besar Fusce consequat. Nulla nisl. Nunc nisl.
S0000242,Configurable Scarf Orange ,WAHANA,"Configurable Scarf Orange  Proin eu mi. Nulla ac enim. In tempor, turpis nec euismod scelerisque, quam turpis adipiscing lorem, vitae mattis nibh ligula nec sem."
S0000243,holistic Scarf Yellow ,POS PAKET KILAT,holistic Scarf Yellow  Fusce consequat. Nulla nisl. Nunc nisl.
S0000244,help-desk Buku Sekolah Blue kecil,LION PARCEL,help-desk Buku Sekolah Blue kecil Nulla ut erat id mauris vulputate elementum. Nullam varius. Nulla facilisi.
S0000245,Programmable Makanan Indigo ,POS PAKET KILAT,Programmable Makanan Indigo  Maecenas ut massa quis augue luctus tincidunt. Nulla mollis molestie lorem. Quisque ut erat.
S0000246,Profound Obat & Alat Kesehatan Green ,TIKI REGULER,"Profound Obat & Alat Kesehatan Green  Donec diam neque, vestibulum eget, vulputate ut, ultrices vel, augue. Vestibulum ante ipsum primis in faucibus orci luctus et ultrices posuere cubilia Curae; Donec pharetra, magna vestibulum aliquet ultrices, erat tortor sollicitudin mi, sit amet lobortis sapien sapien non mi. Integer ac neque."
S0000247,"capacity Perawatan Tangan, Kaki dan Kuku Turquoise ",WAHANA,"capacity Perawatan Tangan, Kaki dan Kuku Turquoise  Fusce posuere felis sed lacus. Morbi sem mauris, laoreet ut, rhoncus aliquet, pulvinar sed, nisl. Nunc rhoncus dui vel sem."
